[INFO] Scanning for projects...
[INFO] ------------------------------------------------------------------------
[INFO] Reactor Build Order:
[INFO] 
[INFO] OpenGrok
[INFO] Java RCS
[INFO] OpenGrok Indexer
[INFO] OpenGrok Sample Plugins
[INFO] OpenGrok Web
[INFO]                                                                         
[INFO] ------------------------------------------------------------------------
[INFO] Building OpenGrok 0.13-SNAPSHOT
[INFO] ------------------------------------------------------------------------
[INFO]                                                                         
[INFO] ------------------------------------------------------------------------
[INFO] Building Java RCS 0.13-SNAPSHOT
[INFO] ------------------------------------------------------------------------
[INFO] 
[INFO] --- maven-resources-plugin:2.6:resources (default-resources) @ jrcs ---
[INFO] Using 'UTF-8' encoding to copy filtered resources.
[INFO] skip non existing resourceDirectory /root/workspace/OpenGrok/OpenGrok/219716179/jrcs/src/main/resources
[INFO] 
[INFO] --- maven-compiler-plugin:3.5.1:compile (default-compile) @ jrcs ---
[INFO] Nothing to compile - all classes are up to date
[INFO] 
[INFO] --- maven-resources-plugin:2.6:testResources (default-testResources) @ jrcs ---
[INFO] Using 'UTF-8' encoding to copy filtered resources.
[INFO] skip non existing resourceDirectory /root/workspace/OpenGrok/OpenGrok/219716179/jrcs/src/test/resources
[INFO] 
[INFO] --- maven-compiler-plugin:3.5.1:testCompile (default-testCompile) @ jrcs ---
[INFO] No sources to compile
[INFO] 
[INFO] --- maven-surefire-plugin:2.19.1:test (default-test) @ jrcs ---
[INFO] No tests to run.
[INFO]                                                                         
[INFO] ------------------------------------------------------------------------
[INFO] Building OpenGrok Indexer 0.13-SNAPSHOT
[INFO] ------------------------------------------------------------------------
[INFO] 
[INFO] --- jflex-maven-plugin:1.6.1:generate (default) @ opengrok-indexer ---
[INFO]   FortranXref.java is up to date.
[INFO]   FortranSymbolTokenizer.java is up to date.
[INFO]   PerlXref.java is up to date.
[INFO]   PerlSymbolTokenizer.java is up to date.
[INFO]   LispSymbolTokenizer.java is up to date.
[INFO]   LispXref.java is up to date.
[INFO]   LuaXref.java is up to date.
[INFO]   LuaSymbolTokenizer.java is up to date.
[INFO]   CxxSymbolTokenizer.java is up to date.
[INFO]   CSymbolTokenizer.java is up to date.
[INFO]   CxxXref.java is up to date.
[INFO]   CXref.java is up to date.
[INFO]   PLSQLXref.java is up to date.
[INFO]   SQLXref.java is up to date.
[INFO]   JavaXref.java is up to date.
[INFO]   JavaSymbolTokenizer.java is up to date.
[INFO]   HaskellSymbolTokenizer.java is up to date.
[INFO]   HaskellXref.java is up to date.
[INFO]   ShSymbolTokenizer.java is up to date.
[INFO]   ShXref.java is up to date.
[INFO]   ClojureXref.java is up to date.
[INFO]   ClojureSymbolTokenizer.java is up to date.
[INFO]   PythonSymbolTokenizer.java is up to date.
[INFO]   PythonXref.java is up to date.
[INFO]   CSharpSymbolTokenizer.java is up to date.
[INFO]   CSharpXref.java is up to date.
[INFO]   ScalaXref.java is up to date.
[INFO]   ScalaSymbolTokenizer.java is up to date.
[INFO]   PlainXref.java is up to date.
[INFO]   XMLXref.java is up to date.
[INFO]   PlainSymbolTokenizer.java is up to date.
[INFO]   PlainFullTokenizer.java is up to date.
[INFO]   PascalSymbolTokenizer.java is up to date.
[INFO]   PascalXref.java is up to date.
[INFO]   RustSymbolTokenizer.java is up to date.
[INFO]   RustXref.java is up to date.
[INFO]   TclXref.java is up to date.
[INFO]   TclSymbolTokenizer.java is up to date.
[INFO]   ErlangXref.java is up to date.
[INFO]   ErlangSymbolTokenizer.java is up to date.
[INFO]   JavaScriptXref.java is up to date.
[INFO]   JavaScriptSymbolTokenizer.java is up to date.
[INFO]   UuencodeFullTokenizer.java is up to date.
[INFO]   UuencodeXref.java is up to date.
[INFO]   PhpSymbolTokenizer.java is up to date.
[INFO]   PhpXref.java is up to date.
[INFO]   VBXref.java is up to date.
[INFO]   VBSymbolTokenizer.java is up to date.
[INFO]   TroffXref.java is up to date.
[INFO]   TroffFullTokenizer.java is up to date.
[INFO]   GolangSymbolTokenizer.java is up to date.
[INFO]   GolangXref.java is up to date.
[INFO]   HistoryLineTokenizer.java is up to date.
[INFO]   PlainLineTokenizer.java is up to date.
[INFO] 
[INFO] --- replacer:1.5.3:replace (default) @ opengrok-indexer ---
[INFO] Replacement run on 4 files.
[INFO] 
[INFO] --- maven-antrun-plugin:1.8:run (default) @ opengrok-indexer ---
[INFO] Executing tasks

main:

-check-is-git-repo:

-get-changeset-from-command:

-get-changeset-from-file:

-update-build-info:
[propertyfile] Updating property file: /root/workspace/OpenGrok/OpenGrok/219716179/opengrok-indexer/target/classes/org/opensolaris/opengrok/info.properties
[INFO] Executed tasks
[INFO] 
[INFO] --- maven-resources-plugin:2.6:resources (default-resources) @ opengrok-indexer ---
[INFO] Using 'UTF-8' encoding to copy filtered resources.
[INFO] Copying 6 resources to org/opensolaris/opengrok/analysis/sql/
[INFO] Copying 1 resource to org/opensolaris/opengrok/analysis/vb/
[INFO] Copying 1 resource to org/opensolaris/opengrok/index/
[INFO] Copying 0 resource to org/opensolaris/opengrok/history/
[INFO] 
[INFO] --- maven-compiler-plugin:3.5.1:compile (default-compile) @ opengrok-indexer ---
[INFO] Changes detected - recompiling the module!
[INFO] Compiling 295 source files to /root/workspace/OpenGrok/OpenGrok/219716179/opengrok-indexer/target/classes
[INFO] 
[INFO] --- maven-resources-plugin:2.6:testResources (default-testResources) @ opengrok-indexer ---
[INFO] Using 'UTF-8' encoding to copy filtered resources.
[INFO] Copying 8 resources to org/opensolaris/opengrok/history/
[INFO] Copying 2 resources to org/opensolaris/opengrok/analysis/php/
[INFO] Copying 2 resources to org/opensolaris/opengrok/analysis/haskell/
[INFO] Copying 1 resource to org/opensolaris/opengrok/analysis/java/
[INFO] 
[INFO] --- maven-compiler-plugin:3.5.1:testCompile (default-testCompile) @ opengrok-indexer ---
[INFO] Nothing to compile - all classes are up to date
[INFO] 
[INFO] --- maven-antrun-plugin:1.8:run (build-config-files) @ opengrok-indexer ---
[INFO] Executing tasks

main:

-post-compile-test:

-create-svn-repository:
   [delete] Deleting directory /root/workspace/OpenGrok/OpenGrok/219716179/opengrok-indexer/target/reposroot/svn
     [exec] Adding         /root/workspace/OpenGrok/OpenGrok/219716179/testdata/sources/archives
     [exec] Adding  (bin)  /root/workspace/OpenGrok/OpenGrok/219716179/testdata/sources/archives/tarfile.tar
     [exec] Adding  (bin)  /root/workspace/OpenGrok/OpenGrok/219716179/testdata/sources/archives/tarfile.tar.bz2
     [exec] Adding  (bin)  /root/workspace/OpenGrok/OpenGrok/219716179/testdata/sources/archives/tarfile.tar.gz
     [exec] Adding         /root/workspace/OpenGrok/OpenGrok/219716179/testdata/sources/bug14924
     [exec] Adding         /root/workspace/OpenGrok/OpenGrok/219716179/testdata/sources/bug14924/FileLogFormatter.java
     [exec] Adding         /root/workspace/OpenGrok/OpenGrok/219716179/testdata/sources/bug16070
     [exec] Adding         /root/workspace/OpenGrok/OpenGrok/219716179/testdata/sources/bug16070/arguments.c
     [exec] Adding         /root/workspace/OpenGrok/OpenGrok/219716179/testdata/sources/bug16465
     [exec] Adding         /root/workspace/OpenGrok/OpenGrok/219716179/testdata/sources/bug16465/bugreport16465@
     [exec] Adding         /root/workspace/OpenGrok/OpenGrok/219716179/testdata/sources/bug19195
     [exec] Adding         /root/workspace/OpenGrok/OpenGrok/219716179/testdata/sources/bug19195/ctags.config
     [exec] Adding         /root/workspace/OpenGrok/OpenGrok/219716179/testdata/sources/bug19195/test.s
     [exec] Adding         /root/workspace/OpenGrok/OpenGrok/219716179/testdata/sources/bug3430
     [exec] Adding  (bin)  /root/workspace/OpenGrok/OpenGrok/219716179/testdata/sources/bug3430/truncated
     [exec] Adding  (bin)  /root/workspace/OpenGrok/OpenGrok/219716179/testdata/sources/bug3430/zzcomlete
     [exec] Adding         /root/workspace/OpenGrok/OpenGrok/219716179/testdata/sources/bug3658
     [exec] Adding         /root/workspace/OpenGrok/OpenGrok/219716179/testdata/sources/bug3658/empty.file
     [exec] Adding         /root/workspace/OpenGrok/OpenGrok/219716179/testdata/sources/bug3658/pic.127.5.0.1.1040
     [exec] Adding         /root/workspace/OpenGrok/OpenGrok/219716179/testdata/sources/c
     [exec] Adding         /root/workspace/OpenGrok/OpenGrok/219716179/testdata/sources/c/Makefile
     [exec] Adding         /root/workspace/OpenGrok/OpenGrok/219716179/testdata/sources/c/bug15890.c
     [exec] Adding         /root/workspace/OpenGrok/OpenGrok/219716179/testdata/sources/c/foobar.c
     [exec] Adding         /root/workspace/OpenGrok/OpenGrok/219716179/testdata/sources/c/header.h
     [exec] Adding         /root/workspace/OpenGrok/OpenGrok/219716179/testdata/sources/c/i386
     [exec] Adding  (bin)  /root/workspace/OpenGrok/OpenGrok/219716179/testdata/sources/c/i386/testsprog
     [exec] Adding         /root/workspace/OpenGrok/OpenGrok/219716179/testdata/sources/c/main.c
     [exec] Adding         /root/workspace/OpenGrok/OpenGrok/219716179/testdata/sources/c/myclass.cc
     [exec] Adding         /root/workspace/OpenGrok/OpenGrok/219716179/testdata/sources/c/sample.c
     [exec] Adding         /root/workspace/OpenGrok/OpenGrok/219716179/testdata/sources/c/sample.cxx
     [exec] Adding         /root/workspace/OpenGrok/OpenGrok/219716179/testdata/sources/c/sparc
     [exec] Adding  (bin)  /root/workspace/OpenGrok/OpenGrok/219716179/testdata/sources/c/sparc/testsprog
     [exec] Adding         /root/workspace/OpenGrok/OpenGrok/219716179/testdata/sources/clojure
     [exec] Adding         /root/workspace/OpenGrok/OpenGrok/219716179/testdata/sources/clojure/sample.clj
     [exec] Adding         /root/workspace/OpenGrok/OpenGrok/219716179/testdata/sources/csharp
     [exec] Adding         /root/workspace/OpenGrok/OpenGrok/219716179/testdata/sources/csharp/Sample.cs
     [exec] Adding         /root/workspace/OpenGrok/OpenGrok/219716179/testdata/sources/data
     [exec] Adding  (bin)  /root/workspace/OpenGrok/OpenGrok/219716179/testdata/sources/data/Logo.png
     [exec] Adding  (bin)  /root/workspace/OpenGrok/OpenGrok/219716179/testdata/sources/data/README.pdf
     [exec] Adding         /root/workspace/OpenGrok/OpenGrok/219716179/testdata/sources/document
     [exec] Adding         /root/workspace/OpenGrok/OpenGrok/219716179/testdata/sources/document/document.html
     [exec] Adding         /root/workspace/OpenGrok/OpenGrok/219716179/testdata/sources/document/document.xml
     [exec] Adding         /root/workspace/OpenGrok/OpenGrok/219716179/testdata/sources/document/foobar.1
     [exec] Adding         /root/workspace/OpenGrok/OpenGrok/219716179/testdata/sources/fortran
     [exec] Adding         /root/workspace/OpenGrok/OpenGrok/219716179/testdata/sources/fortran/hello.f90
     [exec] Adding         /root/workspace/OpenGrok/OpenGrok/219716179/testdata/sources/haskell
     [exec] Adding         /root/workspace/OpenGrok/OpenGrok/219716179/testdata/sources/haskell/bug15890.hs
     [exec] Adding         /root/workspace/OpenGrok/OpenGrok/219716179/testdata/sources/issue10
     [exec] Adding  (bin)  /root/workspace/OpenGrok/OpenGrok/219716179/testdata/sources/issue10/bcel-5.2small.jar
     [exec] Adding         /root/workspace/OpenGrok/OpenGrok/219716179/testdata/sources/java
     [exec] Adding  (bin)  /root/workspace/OpenGrok/OpenGrok/219716179/testdata/sources/java/Main.class
     [exec] Adding         /root/workspace/OpenGrok/OpenGrok/219716179/testdata/sources/java/Main.java
     [exec] Adding         /root/workspace/OpenGrok/OpenGrok/219716179/testdata/sources/java/Sample.java
     [exec] Adding         /root/workspace/OpenGrok/OpenGrok/219716179/testdata/sources/java/bug15890.java
     [exec] Adding  (bin)  /root/workspace/OpenGrok/OpenGrok/219716179/testdata/sources/java/main.jar
     [exec] Adding         /root/workspace/OpenGrok/OpenGrok/219716179/testdata/sources/javascript
     [exec] Adding         /root/workspace/OpenGrok/OpenGrok/219716179/testdata/sources/javascript/function.js
     [exec] Adding         /root/workspace/OpenGrok/OpenGrok/219716179/testdata/sources/javascript/testlong.js
     [exec] Adding         /root/workspace/OpenGrok/OpenGrok/219716179/testdata/sources/lisp
     [exec] Adding         /root/workspace/OpenGrok/OpenGrok/219716179/testdata/sources/lisp/bug15890.lisp
     [exec] Adding         /root/workspace/OpenGrok/OpenGrok/219716179/testdata/sources/lisp/test.el
     [exec] Adding         /root/workspace/OpenGrok/OpenGrok/219716179/testdata/sources/pascal
     [exec] Adding         /root/workspace/OpenGrok/OpenGrok/219716179/testdata/sources/pascal/Sample.pas
     [exec] Adding         /root/workspace/OpenGrok/OpenGrok/219716179/testdata/sources/perl
     [exec] Adding         /root/workspace/OpenGrok/OpenGrok/219716179/testdata/sources/perl/main.pl
     [exec] Adding         /root/workspace/OpenGrok/OpenGrok/219716179/testdata/sources/php
     [exec] Adding         /root/workspace/OpenGrok/OpenGrok/219716179/testdata/sources/php/my_php.inc
     [exec] Adding         /root/workspace/OpenGrok/OpenGrok/219716179/testdata/sources/python
     [exec] Adding         /root/workspace/OpenGrok/OpenGrok/219716179/testdata/sources/python/main.py
     [exec] Adding         /root/workspace/OpenGrok/OpenGrok/219716179/testdata/sources/rfe2575
     [exec] Adding         /root/workspace/OpenGrok/OpenGrok/219716179/testdata/sources/rfe2575/SCCS
     [exec] Adding         /root/workspace/OpenGrok/OpenGrok/219716179/testdata/sources/rfe2575/SCCS/s.versioned.txt
     [exec] Adding         /root/workspace/OpenGrok/OpenGrok/219716179/testdata/sources/rfe2575/non-versioned.txt
     [exec] Adding         /root/workspace/OpenGrok/OpenGrok/219716179/testdata/sources/rfe2575/versioned.txt
     [exec] Adding         /root/workspace/OpenGrok/OpenGrok/219716179/testdata/sources/rust
     [exec] Adding         /root/workspace/OpenGrok/OpenGrok/219716179/testdata/sources/rust/main.rs
     [exec] Adding         /root/workspace/OpenGrok/OpenGrok/219716179/testdata/sources/scala
     [exec] Adding         /root/workspace/OpenGrok/OpenGrok/219716179/testdata/sources/scala/computeserver.scala
     [exec] Adding         /root/workspace/OpenGrok/OpenGrok/219716179/testdata/sources/scopes
     [exec] Adding         /root/workspace/OpenGrok/OpenGrok/219716179/testdata/sources/scopes/scopes_eof
     [exec] Adding         /root/workspace/OpenGrok/OpenGrok/219716179/testdata/sources/scopes/scopes_eof/sample.cpp
     [exec] Adding         /root/workspace/OpenGrok/OpenGrok/219716179/testdata/sources/scopes/scopes_eol_win
     [exec] Adding         /root/workspace/OpenGrok/OpenGrok/219716179/testdata/sources/scopes/scopes_eol_win/WeirdEOL.java
     [exec] Adding         /root/workspace/OpenGrok/OpenGrok/219716179/testdata/sources/script
     [exec] Adding         /root/workspace/OpenGrok/OpenGrok/219716179/testdata/sources/script/bazaar.sh
     [exec] Adding         /root/workspace/OpenGrok/OpenGrok/219716179/testdata/sources/script/bug15661.ksh
     [exec] Adding         /root/workspace/OpenGrok/OpenGrok/219716179/testdata/sources/sql
     [exec] Adding         /root/workspace/OpenGrok/OpenGrok/219716179/testdata/sources/sql/bug18586.sql
     [exec] Adding         /root/workspace/OpenGrok/OpenGrok/219716179/testdata/sources/sql/test.sql
     [exec] Adding         /root/workspace/OpenGrok/OpenGrok/219716179/testdata/sources/tcl
     [exec] Adding         /root/workspace/OpenGrok/OpenGrok/219716179/testdata/sources/tcl/test.tcl
     [exec] 
     [exec] Committed revision 1.
     [exec] A    /root/workspace/OpenGrok/OpenGrok/219716179/testdata/repositories/svn/bug3430
     [exec] A    /root/workspace/OpenGrok/OpenGrok/219716179/testdata/repositories/svn/bug3430/truncated
     [exec] A    /root/workspace/OpenGrok/OpenGrok/219716179/testdata/repositories/svn/bug3430/zzcomlete
     [exec] A    /root/workspace/OpenGrok/OpenGrok/219716179/testdata/repositories/svn/php
     [exec] A    /root/workspace/OpenGrok/OpenGrok/219716179/testdata/repositories/svn/php/my_php.inc
     [exec] A    /root/workspace/OpenGrok/OpenGrok/219716179/testdata/repositories/svn/issue10
     [exec] A    /root/workspace/OpenGrok/OpenGrok/219716179/testdata/repositories/svn/issue10/bcel-5.2small.jar
     [exec] A    /root/workspace/OpenGrok/OpenGrok/219716179/testdata/repositories/svn/scopes
     [exec] A    /root/workspace/OpenGrok/OpenGrok/219716179/testdata/repositories/svn/scopes/scopes_eof
     [exec] A    /root/workspace/OpenGrok/OpenGrok/219716179/testdata/repositories/svn/scopes/scopes_eof/sample.cpp
     [exec] A    /root/workspace/OpenGrok/OpenGrok/219716179/testdata/repositories/svn/scopes/scopes_eol_win
     [exec] A    /root/workspace/OpenGrok/OpenGrok/219716179/testdata/repositories/svn/scopes/scopes_eol_win/WeirdEOL.java
     [exec] A    /root/workspace/OpenGrok/OpenGrok/219716179/testdata/repositories/svn/rust
     [exec] A    /root/workspace/OpenGrok/OpenGrok/219716179/testdata/repositories/svn/rust/main.rs
     [exec] A    /root/workspace/OpenGrok/OpenGrok/219716179/testdata/repositories/svn/sql
     [exec] A    /root/workspace/OpenGrok/OpenGrok/219716179/testdata/repositories/svn/sql/test.sql
     [exec] A    /root/workspace/OpenGrok/OpenGrok/219716179/testdata/repositories/svn/sql/bug18586.sql
     [exec] A    /root/workspace/OpenGrok/OpenGrok/219716179/testdata/repositories/svn/rfe2575
     [exec] A    /root/workspace/OpenGrok/OpenGrok/219716179/testdata/repositories/svn/rfe2575/SCCS
     [exec] A    /root/workspace/OpenGrok/OpenGrok/219716179/testdata/repositories/svn/rfe2575/SCCS/s.versioned.txt
     [exec] A    /root/workspace/OpenGrok/OpenGrok/219716179/testdata/repositories/svn/rfe2575/versioned.txt
     [exec] A    /root/workspace/OpenGrok/OpenGrok/219716179/testdata/repositories/svn/rfe2575/non-versioned.txt
     [exec] A    /root/workspace/OpenGrok/OpenGrok/219716179/testdata/repositories/svn/perl
     [exec] A    /root/workspace/OpenGrok/OpenGrok/219716179/testdata/repositories/svn/perl/main.pl
     [exec] A    /root/workspace/OpenGrok/OpenGrok/219716179/testdata/repositories/svn/pascal
     [exec] A    /root/workspace/OpenGrok/OpenGrok/219716179/testdata/repositories/svn/pascal/Sample.pas
     [exec] A    /root/workspace/OpenGrok/OpenGrok/219716179/testdata/repositories/svn/bug3658
     [exec] A    /root/workspace/OpenGrok/OpenGrok/219716179/testdata/repositories/svn/bug3658/empty.file
     [exec] A    /root/workspace/OpenGrok/OpenGrok/219716179/testdata/repositories/svn/bug3658/pic.127.5.0.1.1040
     [exec] A    /root/workspace/OpenGrok/OpenGrok/219716179/testdata/repositories/svn/clojure
     [exec] A    /root/workspace/OpenGrok/OpenGrok/219716179/testdata/repositories/svn/clojure/sample.clj
     [exec] A    /root/workspace/OpenGrok/OpenGrok/219716179/testdata/repositories/svn/script
     [exec] A    /root/workspace/OpenGrok/OpenGrok/219716179/testdata/repositories/svn/script/bazaar.sh
     [exec] A    /root/workspace/OpenGrok/OpenGrok/219716179/testdata/repositories/svn/script/bug15661.ksh
     [exec] A    /root/workspace/OpenGrok/OpenGrok/219716179/testdata/repositories/svn/archives
     [exec] A    /root/workspace/OpenGrok/OpenGrok/219716179/testdata/repositories/svn/archives/tarfile.tar.bz2
     [exec] A    /root/workspace/OpenGrok/OpenGrok/219716179/testdata/repositories/svn/archives/tarfile.tar.gz
     [exec] A    /root/workspace/OpenGrok/OpenGrok/219716179/testdata/repositories/svn/archives/tarfile.tar
     [exec] A    /root/workspace/OpenGrok/OpenGrok/219716179/testdata/repositories/svn/javascript
     [exec] A    /root/workspace/OpenGrok/OpenGrok/219716179/testdata/repositories/svn/javascript/testlong.js
     [exec] A    /root/workspace/OpenGrok/OpenGrok/219716179/testdata/repositories/svn/javascript/function.js
     [exec] A    /root/workspace/OpenGrok/OpenGrok/219716179/testdata/repositories/svn/lisp
     [exec] A    /root/workspace/OpenGrok/OpenGrok/219716179/testdata/repositories/svn/lisp/bug15890.lisp
     [exec] A    /root/workspace/OpenGrok/OpenGrok/219716179/testdata/repositories/svn/lisp/test.el
     [exec] A    /root/workspace/OpenGrok/OpenGrok/219716179/testdata/repositories/svn/data
     [exec] A    /root/workspace/OpenGrok/OpenGrok/219716179/testdata/repositories/svn/data/Logo.png
     [exec] A    /root/workspace/OpenGrok/OpenGrok/219716179/testdata/repositories/svn/data/README.pdf
     [exec] A    /root/workspace/OpenGrok/OpenGrok/219716179/testdata/repositories/svn/bug16070
     [exec] A    /root/workspace/OpenGrok/OpenGrok/219716179/testdata/repositories/svn/bug16070/arguments.c
     [exec] A    /root/workspace/OpenGrok/OpenGrok/219716179/testdata/repositories/svn/fortran
     [exec] A    /root/workspace/OpenGrok/OpenGrok/219716179/testdata/repositories/svn/fortran/hello.f90
     [exec] A    /root/workspace/OpenGrok/OpenGrok/219716179/testdata/repositories/svn/document
     [exec] A    /root/workspace/OpenGrok/OpenGrok/219716179/testdata/repositories/svn/document/foobar.1
     [exec] A    /root/workspace/OpenGrok/OpenGrok/219716179/testdata/repositories/svn/document/document.xml
     [exec] A    /root/workspace/OpenGrok/OpenGrok/219716179/testdata/repositories/svn/document/document.html
     [exec] A    /root/workspace/OpenGrok/OpenGrok/219716179/testdata/repositories/svn/csharp
     [exec] A    /root/workspace/OpenGrok/OpenGrok/219716179/testdata/repositories/svn/csharp/Sample.cs
     [exec] A    /root/workspace/OpenGrok/OpenGrok/219716179/testdata/repositories/svn/java
     [exec] A    /root/workspace/OpenGrok/OpenGrok/219716179/testdata/repositories/svn/java/Main.class
     [exec] A    /root/workspace/OpenGrok/OpenGrok/219716179/testdata/repositories/svn/java/main.jar
     [exec] A    /root/workspace/OpenGrok/OpenGrok/219716179/testdata/repositories/svn/java/Sample.java
     [exec] A    /root/workspace/OpenGrok/OpenGrok/219716179/testdata/repositories/svn/java/Main.java
     [exec] A    /root/workspace/OpenGrok/OpenGrok/219716179/testdata/repositories/svn/java/bug15890.java
     [exec] A    /root/workspace/OpenGrok/OpenGrok/219716179/testdata/repositories/svn/bug14924
     [exec] A    /root/workspace/OpenGrok/OpenGrok/219716179/testdata/repositories/svn/bug14924/FileLogFormatter.java
     [exec] A    /root/workspace/OpenGrok/OpenGrok/219716179/testdata/repositories/svn/python
     [exec] A    /root/workspace/OpenGrok/OpenGrok/219716179/testdata/repositories/svn/python/main.py
     [exec] A    /root/workspace/OpenGrok/OpenGrok/219716179/testdata/repositories/svn/c
     [exec] A    /root/workspace/OpenGrok/OpenGrok/219716179/testdata/repositories/svn/c/Makefile
     [exec] A    /root/workspace/OpenGrok/OpenGrok/219716179/testdata/repositories/svn/c/header.h
     [exec] A    /root/workspace/OpenGrok/OpenGrok/219716179/testdata/repositories/svn/c/myclass.cc
     [exec] A    /root/workspace/OpenGrok/OpenGrok/219716179/testdata/repositories/svn/c/sample.c
     [exec] A    /root/workspace/OpenGrok/OpenGrok/219716179/testdata/repositories/svn/c/sample.cxx
     [exec] A    /root/workspace/OpenGrok/OpenGrok/219716179/testdata/repositories/svn/c/bug15890.c
     [exec] A    /root/workspace/OpenGrok/OpenGrok/219716179/testdata/repositories/svn/c/main.c
     [exec] A    /root/workspace/OpenGrok/OpenGrok/219716179/testdata/repositories/svn/c/sparc
     [exec] A    /root/workspace/OpenGrok/OpenGrok/219716179/testdata/repositories/svn/c/sparc/testsprog
     [exec] A    /root/workspace/OpenGrok/OpenGrok/219716179/testdata/repositories/svn/c/foobar.c
     [exec] A    /root/workspace/OpenGrok/OpenGrok/219716179/testdata/repositories/svn/c/i386
     [exec] A    /root/workspace/OpenGrok/OpenGrok/219716179/testdata/repositories/svn/c/i386/testsprog
     [exec] A    /root/workspace/OpenGrok/OpenGrok/219716179/testdata/repositories/svn/tcl
     [exec] A    /root/workspace/OpenGrok/OpenGrok/219716179/testdata/repositories/svn/tcl/test.tcl
     [exec] A    /root/workspace/OpenGrok/OpenGrok/219716179/testdata/repositories/svn/haskell
     [exec] A    /root/workspace/OpenGrok/OpenGrok/219716179/testdata/repositories/svn/haskell/bug15890.hs
     [exec] A    /root/workspace/OpenGrok/OpenGrok/219716179/testdata/repositories/svn/bug16465
     [exec] A    /root/workspace/OpenGrok/OpenGrok/219716179/testdata/repositories/svn/bug16465/bugreport16465@
     [exec] A    /root/workspace/OpenGrok/OpenGrok/219716179/testdata/repositories/svn/scala
     [exec] A    /root/workspace/OpenGrok/OpenGrok/219716179/testdata/repositories/svn/scala/computeserver.scala
     [exec] A    /root/workspace/OpenGrok/OpenGrok/219716179/testdata/repositories/svn/bug19195
     [exec] A    /root/workspace/OpenGrok/OpenGrok/219716179/testdata/repositories/svn/bug19195/test.s
     [exec] A    /root/workspace/OpenGrok/OpenGrok/219716179/testdata/repositories/svn/bug19195/ctags.config
     [exec] Checked out revision 1.

-create-razor-repository:
     [copy] Copying 4 files to /root/workspace/OpenGrok/OpenGrok/219716179/testdata/repositories/razor/Razor-Simple
     [copy] Copying 20 files to /root/workspace/OpenGrok/OpenGrok/219716179/testdata/repositories/razor/Razor-Simple/SimpleCProgram/.razor
     [copy] Copying 50 files to /root/workspace/OpenGrok/OpenGrok/219716179/testdata/repositories/git/.git
     [copy] Copying 27 files to /root/workspace/OpenGrok/OpenGrok/219716179/testdata/repositories/mercurial/.hg
     [copy] Copying 1 file to /root/workspace/OpenGrok/OpenGrok/219716179/testdata/repositories/mercurial
      [zip] Building zip: /root/workspace/OpenGrok/OpenGrok/219716179/opengrok-indexer/target/test-classes/org/opensolaris/opengrok/history/repositories.zip

-delete-generated-repository-files:
   [delete] Deleting directory /root/workspace/OpenGrok/OpenGrok/219716179/testdata/repositories/mercurial/.hg
   [delete] Deleting: /root/workspace/OpenGrok/OpenGrok/219716179/testdata/repositories/mercurial/.hgignore
   [delete] Deleting directory /root/workspace/OpenGrok/OpenGrok/219716179/testdata/repositories/git/.git
   [delete] Deleting directory /root/workspace/OpenGrok/OpenGrok/219716179/testdata/repositories/svn
   [delete] Deleting directory /root/workspace/OpenGrok/OpenGrok/219716179/testdata/repositories/razor
   [delete] Deleting: /root/workspace/OpenGrok/OpenGrok/219716179/testdata/repositories/cvs_test/cvsrepo/CVS/Root
[INFO] Executed tasks
[INFO] 
[INFO] --- maven-surefire-plugin:2.19.1:test (default-test) @ opengrok-indexer ---
[INFO] Downloading: http://repo.maven.apache.org/maven2/org/apache/maven/surefire/surefire-junit4/2.19.1/surefire-junit4-2.19.1.pom
[INFO] Downloaded: http://repo.maven.apache.org/maven2/org/apache/maven/surefire/surefire-junit4/2.19.1/surefire-junit4-2.19.1.pom (4 KB at 12.4 KB/sec)
[INFO] Downloading: http://repo.maven.apache.org/maven2/org/apache/maven/surefire/surefire-providers/2.19.1/surefire-providers-2.19.1.pom
[INFO] Downloaded: http://repo.maven.apache.org/maven2/org/apache/maven/surefire/surefire-providers/2.19.1/surefire-providers-2.19.1.pom (3 KB at 71.5 KB/sec)
[INFO] Downloading: http://repo.maven.apache.org/maven2/org/apache/maven/surefire/surefire-junit4/2.19.1/surefire-junit4-2.19.1.jar
[INFO] Downloaded: http://repo.maven.apache.org/maven2/org/apache/maven/surefire/surefire-junit4/2.19.1/surefire-junit4-2.19.1.jar (74 KB at 2045.9 KB/sec)

-------------------------------------------------------
 T E S T S
-------------------------------------------------------
Running org.opensolaris.opengrok.index.IndexerTest
Tests run: 1, Failures: 1, Errors: 0, Skipped: 0, Time elapsed: 0.415 sec <<< FAILURE! - in org.opensolaris.opengrok.index.IndexerTest
org.opensolaris.opengrok.index.IndexerTest  Time elapsed: 0.413 sec  <<< FAILURE!
java.lang.AssertionError: No point in running indexer tests without valid ctags
	at org.opensolaris.opengrok.index.IndexerTest.setUpClass(IndexerTest.java:71)

Running org.opensolaris.opengrok.index.IgnoredNamesTest
Tests run: 3, Failures: 0, Errors: 0, Skipped: 0, Time elapsed: 0.465 sec - in org.opensolaris.opengrok.index.IgnoredNamesTest
Running org.opensolaris.opengrok.index.IndexerRepoTest
Tests run: 1, Failures: 1, Errors: 0, Skipped: 0, Time elapsed: 0.338 sec <<< FAILURE! - in org.opensolaris.opengrok.index.IndexerRepoTest
org.opensolaris.opengrok.index.IndexerRepoTest  Time elapsed: 0.337 sec  <<< FAILURE!
java.lang.AssertionError: No point in running indexer tests without valid ctags
	at org.opensolaris.opengrok.index.IndexerRepoTest.setUpClass(IndexerRepoTest.java:51)

Running org.opensolaris.opengrok.index.CommandLineOptionsTest
Tests run: 3, Failures: 0, Errors: 0, Skipped: 0, Time elapsed: 0.263 sec - in org.opensolaris.opengrok.index.CommandLineOptionsTest
Running org.opensolaris.opengrok.index.IndexDatabaseTest
Tests run: 2, Failures: 1, Errors: 1, Skipped: 0, Time elapsed: 0.339 sec <<< FAILURE! - in org.opensolaris.opengrok.index.IndexDatabaseTest
org.opensolaris.opengrok.index.IndexDatabaseTest  Time elapsed: 0.338 sec  <<< FAILURE!
java.lang.AssertionError: No ctags available
	at org.opensolaris.opengrok.index.IndexDatabaseTest.setUpClass(IndexDatabaseTest.java:54)

org.opensolaris.opengrok.index.IndexDatabaseTest  Time elapsed: 0.339 sec  <<< ERROR!
java.lang.NullPointerException
	at org.opensolaris.opengrok.index.IndexDatabaseTest.tearDownClass(IndexDatabaseTest.java:72)

Running org.opensolaris.opengrok.configuration.messages.MessageTest
Tests run: 1, Failures: 0, Errors: 0, Skipped: 0, Time elapsed: 0.376 sec - in org.opensolaris.opengrok.configuration.messages.MessageTest
Running org.opensolaris.opengrok.configuration.messages.NormalMessageTest
Tests run: 5, Failures: 0, Errors: 0, Skipped: 0, Time elapsed: 0.238 sec - in org.opensolaris.opengrok.configuration.messages.NormalMessageTest
Running org.opensolaris.opengrok.configuration.messages.StatsMessageTest
Tests run: 6, Failures: 0, Errors: 0, Skipped: 0, Time elapsed: 0.406 sec - in org.opensolaris.opengrok.configuration.messages.StatsMessageTest
Running org.opensolaris.opengrok.configuration.messages.AbortMessageTest
Tests run: 8, Failures: 0, Errors: 0, Skipped: 0, Time elapsed: 0.261 sec - in org.opensolaris.opengrok.configuration.messages.AbortMessageTest
Running org.opensolaris.opengrok.configuration.messages.ExpirationNormalMessageTest
Tests run: 6, Failures: 0, Errors: 0, Skipped: 0, Time elapsed: 3.055 sec - in org.opensolaris.opengrok.configuration.messages.ExpirationNormalMessageTest
Running org.opensolaris.opengrok.configuration.messages.ConfigMessageTest
Tests run: 9, Failures: 0, Errors: 0, Skipped: 0, Time elapsed: 0.66 sec - in org.opensolaris.opengrok.configuration.messages.ConfigMessageTest
Running org.opensolaris.opengrok.configuration.messages.MessagesTest
Tests run: 3, Failures: 0, Errors: 0, Skipped: 0, Time elapsed: 0.788 sec - in org.opensolaris.opengrok.configuration.messages.MessagesTest
Running org.opensolaris.opengrok.configuration.messages.RefreshMessageTest
Tests run: 1, Failures: 0, Errors: 0, Skipped: 0, Time elapsed: 0.2 sec - in org.opensolaris.opengrok.configuration.messages.RefreshMessageTest
Running org.opensolaris.opengrok.configuration.GroupsTest
Tests run: 6, Failures: 0, Errors: 0, Skipped: 0, Time elapsed: 0.353 sec - in org.opensolaris.opengrok.configuration.GroupsTest
Running org.opensolaris.opengrok.configuration.RuntimeEnvironmentTest
Tests run: 46, Failures: 0, Errors: 0, Skipped: 0, Time elapsed: 2.367 sec - in org.opensolaris.opengrok.configuration.RuntimeEnvironmentTest
Running org.opensolaris.opengrok.configuration.GroupTest
Tests run: 5, Failures: 0, Errors: 0, Skipped: 0, Time elapsed: 0.336 sec - in org.opensolaris.opengrok.configuration.GroupTest
Running org.opensolaris.opengrok.configuration.ProjectTest
Tests run: 3, Failures: 0, Errors: 0, Skipped: 0, Time elapsed: 0.592 sec - in org.opensolaris.opengrok.configuration.ProjectTest
Running org.opensolaris.opengrok.util.ExecutorTest
Tests run: 3, Failures: 0, Errors: 0, Skipped: 0, Time elapsed: 0.339 sec - in org.opensolaris.opengrok.util.ExecutorTest
Running org.opensolaris.opengrok.util.StringUtilsTest
Tests run: 2, Failures: 0, Errors: 0, Skipped: 0, Time elapsed: 0.114 sec - in org.opensolaris.opengrok.util.StringUtilsTest
Running org.opensolaris.opengrok.util.GetoptTest
Tests run: 3, Failures: 0, Errors: 0, Skipped: 0, Time elapsed: 0.162 sec - in org.opensolaris.opengrok.util.GetoptTest
Running org.opensolaris.opengrok.util.XmlEofOutputStreamTest
Tests run: 4, Failures: 0, Errors: 0, Skipped: 0, Time elapsed: 0.168 sec - in org.opensolaris.opengrok.util.XmlEofOutputStreamTest
Running org.opensolaris.opengrok.util.InternerTest
Tests run: 4, Failures: 0, Errors: 0, Skipped: 0, Time elapsed: 0.134 sec - in org.opensolaris.opengrok.util.InternerTest
Running org.opensolaris.opengrok.util.XmlEofInputStreamTest
Tests run: 4, Failures: 0, Errors: 0, Skipped: 0, Time elapsed: 0.183 sec - in org.opensolaris.opengrok.util.XmlEofInputStreamTest
Running org.opensolaris.opengrok.analysis.AnalyzerGuruTest
Tests run: 11, Failures: 0, Errors: 0, Skipped: 0, Time elapsed: 0.762 sec - in org.opensolaris.opengrok.analysis.AnalyzerGuruTest
Running org.opensolaris.opengrok.analysis.c.CAnalyzerFactoryTest
Tests run: 1, Failures: 0, Errors: 1, Skipped: 0, Time elapsed: 1.253 sec <<< FAILURE! - in org.opensolaris.opengrok.analysis.c.CAnalyzerFactoryTest
testScopeAnalyzer(org.opensolaris.opengrok.analysis.c.CAnalyzerFactoryTest)  Time elapsed: 0.583 sec  <<< ERROR!
java.io.IOException: Cannot run program "ctags": error=2, No such file or directory
	at org.opensolaris.opengrok.analysis.c.CAnalyzerFactoryTest.testScopeAnalyzer(CAnalyzerFactoryTest.java:117)
Caused by: java.io.IOException: error=2, No such file or directory
	at org.opensolaris.opengrok.analysis.c.CAnalyzerFactoryTest.testScopeAnalyzer(CAnalyzerFactoryTest.java:117)

Running org.opensolaris.opengrok.analysis.c.CxxAnalyzerFactoryTest
/tmp/source8581500205295877016opengrok/c/sample.cxx
Tests run: 1, Failures: 0, Errors: 1, Skipped: 0, Time elapsed: 1.047 sec <<< FAILURE! - in org.opensolaris.opengrok.analysis.c.CxxAnalyzerFactoryTest
testScopeAnalyzer(org.opensolaris.opengrok.analysis.c.CxxAnalyzerFactoryTest)  Time elapsed: 0.451 sec  <<< ERROR!
java.io.IOException: Cannot run program "ctags": error=2, No such file or directory
	at org.opensolaris.opengrok.analysis.c.CxxAnalyzerFactoryTest.testScopeAnalyzer(CxxAnalyzerFactoryTest.java:117)
Caused by: java.io.IOException: error=2, No such file or directory
	at org.opensolaris.opengrok.analysis.c.CxxAnalyzerFactoryTest.testScopeAnalyzer(CxxAnalyzerFactoryTest.java:117)

Running org.opensolaris.opengrok.analysis.java.JavaAnalyzerFactoryTest
Tests run: 1, Failures: 0, Errors: 1, Skipped: 0, Time elapsed: 1.02 sec <<< FAILURE! - in org.opensolaris.opengrok.analysis.java.JavaAnalyzerFactoryTest
testScopeAnalyzer(org.opensolaris.opengrok.analysis.java.JavaAnalyzerFactoryTest)  Time elapsed: 0.476 sec  <<< ERROR!
java.io.IOException: Cannot run program "ctags": error=2, No such file or directory
	at org.opensolaris.opengrok.analysis.java.JavaAnalyzerFactoryTest.testScopeAnalyzer(JavaAnalyzerFactoryTest.java:117)
Caused by: java.io.IOException: error=2, No such file or directory
	at org.opensolaris.opengrok.analysis.java.JavaAnalyzerFactoryTest.testScopeAnalyzer(JavaAnalyzerFactoryTest.java:117)

Running org.opensolaris.opengrok.analysis.java.JavaSymbolTokenizerTest
Tests run: 1, Failures: 0, Errors: 0, Skipped: 0, Time elapsed: 0.335 sec - in org.opensolaris.opengrok.analysis.java.JavaSymbolTokenizerTest
Running org.opensolaris.opengrok.analysis.haskell.HaskellXrefTest
Tests run: 2, Failures: 0, Errors: 0, Skipped: 0, Time elapsed: 0.225 sec - in org.opensolaris.opengrok.analysis.haskell.HaskellXrefTest
Running org.opensolaris.opengrok.analysis.haskell.HaskellSymbolTokenizerTest
Tests run: 1, Failures: 0, Errors: 0, Skipped: 0, Time elapsed: 0.312 sec - in org.opensolaris.opengrok.analysis.haskell.HaskellSymbolTokenizerTest
Running org.opensolaris.opengrok.analysis.TextAnalyzerTest
Tests run: 5, Failures: 0, Errors: 0, Skipped: 0, Time elapsed: 0.332 sec - in org.opensolaris.opengrok.analysis.TextAnalyzerTest
Running org.opensolaris.opengrok.analysis.clojure.ClojureAnalyzerFactoryTest
Tests run: 1, Failures: 0, Errors: 1, Skipped: 0, Time elapsed: 1.155 sec <<< FAILURE! - in org.opensolaris.opengrok.analysis.clojure.ClojureAnalyzerFactoryTest
testScopeAnalyzer(org.opensolaris.opengrok.analysis.clojure.ClojureAnalyzerFactoryTest)  Time elapsed: 0.603 sec  <<< ERROR!
java.io.IOException: Cannot run program "ctags": error=2, No such file or directory
	at org.opensolaris.opengrok.analysis.clojure.ClojureAnalyzerFactoryTest.testScopeAnalyzer(ClojureAnalyzerFactoryTest.java:114)
Caused by: java.io.IOException: error=2, No such file or directory
	at org.opensolaris.opengrok.analysis.clojure.ClojureAnalyzerFactoryTest.testScopeAnalyzer(ClojureAnalyzerFactoryTest.java:114)

Running org.opensolaris.opengrok.analysis.CtagsTest
Tests run: 1, Failures: 1, Errors: 0, Skipped: 0, Time elapsed: 0.38 sec <<< FAILURE! - in org.opensolaris.opengrok.analysis.CtagsTest
org.opensolaris.opengrok.analysis.CtagsTest  Time elapsed: 0.38 sec  <<< FAILURE!
java.lang.AssertionError: No point in running ctags tests without valid ctags
	at org.opensolaris.opengrok.analysis.CtagsTest.setUpClass(CtagsTest.java:67)

Running org.opensolaris.opengrok.analysis.LuceneCompatibilityTest
Tests run: 0, Failures: 0, Errors: 0, Skipped: 0, Time elapsed: 0.054 sec - in org.opensolaris.opengrok.analysis.LuceneCompatibilityTest
Running org.opensolaris.opengrok.analysis.csharp.CSharpAnalyzerFactoryTest
Tests run: 1, Failures: 0, Errors: 1, Skipped: 0, Time elapsed: 0.954 sec <<< FAILURE! - in org.opensolaris.opengrok.analysis.csharp.CSharpAnalyzerFactoryTest
testScopeAnalyzer(org.opensolaris.opengrok.analysis.csharp.CSharpAnalyzerFactoryTest)  Time elapsed: 0.343 sec  <<< ERROR!
java.io.IOException: Cannot run program "ctags": error=2, No such file or directory
	at org.opensolaris.opengrok.analysis.csharp.CSharpAnalyzerFactoryTest.testScopeAnalyzer(CSharpAnalyzerFactoryTest.java:110)
Caused by: java.io.IOException: error=2, No such file or directory
	at org.opensolaris.opengrok.analysis.csharp.CSharpAnalyzerFactoryTest.testScopeAnalyzer(CSharpAnalyzerFactoryTest.java:110)

Running org.opensolaris.opengrok.analysis.JFlexXrefTest
Tests run: 17, Failures: 0, Errors: 2, Skipped: 0, Time elapsed: 0.92 sec <<< FAILURE! - in org.opensolaris.opengrok.analysis.JFlexXrefTest
bug18586(org.opensolaris.opengrok.analysis.JFlexXrefTest)  Time elapsed: 0.104 sec  <<< ERROR!
java.io.IOException: Cannot run program "ctags": error=2, No such file or directory
	at org.opensolaris.opengrok.analysis.JFlexXrefTest.bug18586(JFlexXrefTest.java:351)
Caused by: java.io.IOException: error=2, No such file or directory
	at org.opensolaris.opengrok.analysis.JFlexXrefTest.bug18586(JFlexXrefTest.java:351)

testBug15890Anchor(org.opensolaris.opengrok.analysis.JFlexXrefTest)  Time elapsed: 0.011 sec  <<< ERROR!
java.io.IOException: Cannot run program "ctags": error=2, No such file or directory
	at org.opensolaris.opengrok.analysis.JFlexXrefTest.bug15890Anchor(JFlexXrefTest.java:162)
	at org.opensolaris.opengrok.analysis.JFlexXrefTest.testBug15890Anchor(JFlexXrefTest.java:146)
Caused by: java.io.IOException: error=2, No such file or directory
	at org.opensolaris.opengrok.analysis.JFlexXrefTest.bug15890Anchor(JFlexXrefTest.java:162)
	at org.opensolaris.opengrok.analysis.JFlexXrefTest.testBug15890Anchor(JFlexXrefTest.java:146)

Running org.opensolaris.opengrok.analysis.CtagsParserTest
Tests run: 1, Failures: 0, Errors: 0, Skipped: 0, Time elapsed: 0.157 sec - in org.opensolaris.opengrok.analysis.CtagsParserTest
Running org.opensolaris.opengrok.analysis.ExpandTabsReaderTest
Tests run: 2, Failures: 0, Errors: 0, Skipped: 0, Time elapsed: 0.151 sec - in org.opensolaris.opengrok.analysis.ExpandTabsReaderTest
Running org.opensolaris.opengrok.analysis.PathTokenizerTest
Tests run: 1, Failures: 0, Errors: 0, Skipped: 0, Time elapsed: 0.281 sec - in org.opensolaris.opengrok.analysis.PathTokenizerTest
Running org.opensolaris.opengrok.analysis.plain.XMLAnalyzerTest
Tests run: 3, Failures: 0, Errors: 0, Skipped: 0, Time elapsed: 0.272 sec - in org.opensolaris.opengrok.analysis.plain.XMLAnalyzerTest
Running org.opensolaris.opengrok.analysis.pascal.PascalAnalyzerFactoryTest
Tests run: 1, Failures: 0, Errors: 1, Skipped: 0, Time elapsed: 0.98 sec <<< FAILURE! - in org.opensolaris.opengrok.analysis.pascal.PascalAnalyzerFactoryTest
testAnalyzer(org.opensolaris.opengrok.analysis.pascal.PascalAnalyzerFactoryTest)  Time elapsed: 0.47 sec  <<< ERROR!
java.io.IOException: Cannot run program "ctags": error=2, No such file or directory
	at org.opensolaris.opengrok.analysis.pascal.PascalAnalyzerFactoryTest.testAnalyzer(PascalAnalyzerFactoryTest.java:114)
Caused by: java.io.IOException: error=2, No such file or directory
	at org.opensolaris.opengrok.analysis.pascal.PascalAnalyzerFactoryTest.testAnalyzer(PascalAnalyzerFactoryTest.java:114)

Running org.opensolaris.opengrok.analysis.IteratorReaderTest
Tests run: 4, Failures: 0, Errors: 0, Skipped: 0, Time elapsed: 0.139 sec - in org.opensolaris.opengrok.analysis.IteratorReaderTest
Running org.opensolaris.opengrok.analysis.php.PhpSymbolTokenizerTest
Tests run: 2, Failures: 0, Errors: 0, Skipped: 0, Time elapsed: 0.33 sec - in org.opensolaris.opengrok.analysis.php.PhpSymbolTokenizerTest
Running org.opensolaris.opengrok.analysis.php.PhpXrefTest
Tests run: 3, Failures: 0, Errors: 0, Skipped: 0, Time elapsed: 0.24 sec - in org.opensolaris.opengrok.analysis.php.PhpXrefTest
Running org.opensolaris.opengrok.analysis.JFlexTokenizerTest
Tests run: 3, Failures: 0, Errors: 0, Skipped: 0, Time elapsed: 0.445 sec - in org.opensolaris.opengrok.analysis.JFlexTokenizerTest
Running org.opensolaris.opengrok.analysis.ScopesTest
Tests run: 1, Failures: 0, Errors: 0, Skipped: 0, Time elapsed: 0.149 sec - in org.opensolaris.opengrok.analysis.ScopesTest
Running org.opensolaris.opengrok.analysis.document.TroffAnalyzerTest
Tests run: 1, Failures: 0, Errors: 0, Skipped: 0, Time elapsed: 0.477 sec - in org.opensolaris.opengrok.analysis.document.TroffAnalyzerTest
Running org.opensolaris.opengrok.analysis.DefinitionsTest
Tests run: 8, Failures: 0, Errors: 0, Skipped: 0, Time elapsed: 0.255 sec - in org.opensolaris.opengrok.analysis.DefinitionsTest
Running org.opensolaris.opengrok.search.SummarizerTest
Tests run: 1, Failures: 0, Errors: 0, Skipped: 0, Time elapsed: 0.432 sec - in org.opensolaris.opengrok.search.SummarizerTest
Running org.opensolaris.opengrok.search.SearchEngineTest
Skipping test. Could not find a ctags I could use in path.
Tests run: 8, Failures: 0, Errors: 0, Skipped: 0, Time elapsed: 1.1 sec - in org.opensolaris.opengrok.search.SearchEngineTest
Running org.opensolaris.opengrok.search.SearchTest
Skipping test. Could not find a ctags I could use in path.
Tests run: 6, Failures: 0, Errors: 0, Skipped: 0, Time elapsed: 0.671 sec - in org.opensolaris.opengrok.search.SearchTest
Running org.opensolaris.opengrok.search.context.RegexpMatcherTest
Tests run: 1, Failures: 0, Errors: 0, Skipped: 0, Time elapsed: 0.149 sec - in org.opensolaris.opengrok.search.context.RegexpMatcherTest
Running org.opensolaris.opengrok.search.context.WildCardMatcherTest
Tests run: 1, Failures: 0, Errors: 0, Skipped: 0, Time elapsed: 0.159 sec - in org.opensolaris.opengrok.search.context.WildCardMatcherTest
Running org.opensolaris.opengrok.search.context.ContextTest
Tests run: 9, Failures: 0, Errors: 0, Skipped: 0, Time elapsed: 1.3 sec - in org.opensolaris.opengrok.search.context.ContextTest
Running org.opensolaris.opengrok.search.context.HistoryContextTest
Tests run: 3, Failures: 0, Errors: 0, Skipped: 0, Time elapsed: 3.625 sec - in org.opensolaris.opengrok.search.context.HistoryContextTest
Running org.opensolaris.opengrok.search.HitTest
Tests run: 10, Failures: 0, Errors: 0, Skipped: 0, Time elapsed: 0.169 sec - in org.opensolaris.opengrok.search.HitTest
Running org.opensolaris.opengrok.search.QueryBuilderTest
Tests run: 1, Failures: 0, Errors: 0, Skipped: 0, Time elapsed: 0.444 sec - in org.opensolaris.opengrok.search.QueryBuilderTest
Running org.opensolaris.opengrok.authorization.AuthorizationPluginClassLoaderTest
Tests run: 5, Failures: 0, Errors: 0, Skipped: 0, Time elapsed: 0.238 sec - in org.opensolaris.opengrok.authorization.AuthorizationPluginClassLoaderTest
Running org.opensolaris.opengrok.authorization.AuthorizationFrameworkTest
Tests run: 22, Failures: 0, Errors: 0, Skipped: 0, Time elapsed: 0.475 sec - in org.opensolaris.opengrok.authorization.AuthorizationFrameworkTest
Running org.opensolaris.opengrok.web.PageConfigTest
/tmp/source8436052510899802230opengrok
Tests run: 11, Failures: 4, Errors: 0, Skipped: 0, Time elapsed: 1.91 sec <<< FAILURE! - in org.opensolaris.opengrok.web.PageConfigTest
testCheckSourceRootExistence4(org.opensolaris.opengrok.web.PageConfigTest)  Time elapsed: 0.031 sec  <<< FAILURE!
java.lang.AssertionError: This should throw an exception when the file is not readable
	at org.opensolaris.opengrok.web.PageConfigTest.testCheckSourceRootExistence4(PageConfigTest.java:327)

testGetAnnotation(org.opensolaris.opengrok.web.PageConfigTest)  Time elapsed: 0 sec  <<< FAILURE!
java.lang.AssertionError
	at org.opensolaris.opengrok.web.PageConfigTest.testGetAnnotation(PageConfigTest.java:232)

canProcessHistory(org.opensolaris.opengrok.web.PageConfigTest)  Time elapsed: 0 sec  <<< FAILURE!
java.lang.AssertionError: expected:<> but was:<null>
	at org.opensolaris.opengrok.web.PageConfigTest.assertCanProcess(PageConfigTest.java:369)
	at org.opensolaris.opengrok.web.PageConfigTest.canProcessHistory(PageConfigTest.java:102)

canProcessXref(org.opensolaris.opengrok.web.PageConfigTest)  Time elapsed: 0 sec  <<< FAILURE!
java.lang.AssertionError: expected:<> but was:<null>
	at org.opensolaris.opengrok.web.PageConfigTest.assertCanProcess(PageConfigTest.java:369)
	at org.opensolaris.opengrok.web.PageConfigTest.canProcessXref(PageConfigTest.java:122)

Running org.opensolaris.opengrok.web.SortOrderTest
valueOf
values
Tests run: 2, Failures: 0, Errors: 0, Skipped: 0, Time elapsed: 0.143 sec - in org.opensolaris.opengrok.web.SortOrderTest
Running org.opensolaris.opengrok.web.DirectoryListingTest
<?xml version="1.0" encoding="UTF-8"?>
<start>
<table id="dirlist" class="tablesorter tablesorter-default">
<thead>
<tr>
<th class="sorter-false"></th>
<th>Name</th>
<th class="sorter-false"></th>
<th class="sort-dates">Date</th>
<th class="sort-groksizes">Size</th>
</tr>
</thead>
<tbody>
<tr><td><p class="'r'"/></td><td><b><a href="..">..</a></b></td><td></td><td>Today</td><td>4 KiB</td></tr>
<tr><td><p class="p"/></td><td><a href="foo.c">foo.c</a></td><td class="q"><a href="ctx/history/tmp/directory4590365094142405470opengrokfoo.c" title="History">H</a> <a href="ctx/xref/tmp/directory4590365094142405470opengrokfoo.c?a=true" title="Annotate">A</a> <a href="ctx/download/tmp/directory4590365094142405470opengrokfoo.c" title="Download">D</a></td><td>Today</td><td>1 </td></tr>
<tr><td><p class="p"/></td><td><a href="bar.h">bar.h</a></td><td class="q"><a href="ctx/history/tmp/directory4590365094142405470opengrokbar.h" title="History">H</a> <a href="ctx/xref/tmp/directory4590365094142405470opengrokbar.h?a=true" title="Annotate">A</a> <a href="ctx/download/tmp/directory4590365094142405470opengrokbar.h" title="Download">D</a></td><td>Today</td><td>0 </td></tr>
<tr><td><p class="p"/></td><td><a href=".hg">.hg</a></td><td class="q"><a href="ctx/history/tmp/directory4590365094142405470opengrok.hg" title="History">H</a> <a href="ctx/xref/tmp/directory4590365094142405470opengrok.hg?a=true" title="Annotate">A</a> <a href="ctx/download/tmp/directory4590365094142405470opengrok.hg" title="Download">D</a></td><td>Today</td><td>1 </td></tr>
</tbody>
</table></start>

Tests run: 1, Failures: 0, Errors: 0, Skipped: 0, Time elapsed: 0.213 sec - in org.opensolaris.opengrok.web.DirectoryListingTest
Running org.opensolaris.opengrok.web.UtilTest
Tests run: 21, Failures: 0, Errors: 0, Skipped: 0, Time elapsed: 0.413 sec - in org.opensolaris.opengrok.web.UtilTest
Running org.opensolaris.opengrok.web.EftarFileTest
Tests run: 1, Failures: 0, Errors: 0, Skipped: 0, Time elapsed: 0.396 sec - in org.opensolaris.opengrok.web.EftarFileTest
Running org.opensolaris.opengrok.web.ProjectHelperExtendedTest
Tests run: 10, Failures: 0, Errors: 0, Skipped: 0, Time elapsed: 0.405 sec - in org.opensolaris.opengrok.web.ProjectHelperExtendedTest
Running org.opensolaris.opengrok.web.ProjectHelperTest
Tests run: 20, Failures: 0, Errors: 0, Skipped: 0, Time elapsed: 0.402 sec - in org.opensolaris.opengrok.web.ProjectHelperTest
Running org.opensolaris.opengrok.web.StatisticsTest
Tests run: 9, Failures: 0, Errors: 0, Skipped: 0, Time elapsed: 0.185 sec - in org.opensolaris.opengrok.web.StatisticsTest
Running org.opensolaris.opengrok.web.SearchHelperTest
Skipping test. Could not find a ctags I could use in path.
Tests run: 2, Failures: 0, Errors: 0, Skipped: 0, Time elapsed: 0.523 sec - in org.opensolaris.opengrok.web.SearchHelperTest
Running org.opensolaris.opengrok.history.SCCSgetTest
sccs not available. Skipping test
Tests run: 1, Failures: 0, Errors: 0, Skipped: 0, Time elapsed: 0.281 sec - in org.opensolaris.opengrok.history.SCCSgetTest
Running org.opensolaris.opengrok.history.SubversionHistoryParserTest
Tests run: 3, Failures: 0, Errors: 0, Skipped: 0, Time elapsed: 0.394 sec - in org.opensolaris.opengrok.history.SubversionHistoryParserTest
Running org.opensolaris.opengrok.history.PerforceHistoryParserTest
Tests run: 2, Failures: 0, Errors: 0, Skipped: 0, Time elapsed: 0.197 sec - in org.opensolaris.opengrok.history.PerforceHistoryParserTest
Running org.opensolaris.opengrok.history.RepositoryTest
Tests run: 4, Failures: 0, Errors: 0, Skipped: 0, Time elapsed: 0.241 sec - in org.opensolaris.opengrok.history.RepositoryTest
Running org.opensolaris.opengrok.history.SSCMHistoryParserTest
Tests run: 2, Failures: 0, Errors: 0, Skipped: 0, Time elapsed: 0.182 sec - in org.opensolaris.opengrok.history.SSCMHistoryParserTest
Running org.opensolaris.opengrok.history.SubversionRepositoryTest
Tests run: 1, Failures: 0, Errors: 0, Skipped: 0, Time elapsed: 0.194 sec - in org.opensolaris.opengrok.history.SubversionRepositoryTest
Running org.opensolaris.opengrok.history.ClearCaseHistoryParserTest
Tests run: 2, Failures: 0, Errors: 0, Skipped: 0, Time elapsed: 0.191 sec - in org.opensolaris.opengrok.history.ClearCaseHistoryParserTest
Running org.opensolaris.opengrok.history.SCCSRepositoryTest
Tests run: 1, Failures: 0, Errors: 0, Skipped: 0, Time elapsed: 0.171 sec - in org.opensolaris.opengrok.history.SCCSRepositoryTest
Running org.opensolaris.opengrok.history.HistoryGuruTest
Tests run: 6, Failures: 0, Errors: 0, Skipped: 0, Time elapsed: 12.672 sec - in org.opensolaris.opengrok.history.HistoryGuruTest
Running org.opensolaris.opengrok.history.BazaarHistoryParserTest
Tests run: 3, Failures: 0, Errors: 0, Skipped: 0, Time elapsed: 0.166 sec - in org.opensolaris.opengrok.history.BazaarHistoryParserTest
Running org.opensolaris.opengrok.history.CVSRepositoryTest
Tests run: 3, Failures: 0, Errors: 0, Skipped: 0, Time elapsed: 0.227 sec - in org.opensolaris.opengrok.history.CVSRepositoryTest
Running org.opensolaris.opengrok.history.AnnotationTest
Tests run: 8, Failures: 0, Errors: 0, Skipped: 0, Time elapsed: 0.206 sec - in org.opensolaris.opengrok.history.AnnotationTest
Running org.opensolaris.opengrok.history.RCSRepositoryTest
Tests run: 1, Failures: 0, Errors: 0, Skipped: 0, Time elapsed: 0.669 sec - in org.opensolaris.opengrok.history.RCSRepositoryTest
Running org.opensolaris.opengrok.history.CVSHistoryParserTest
Tests run: 2, Failures: 0, Errors: 0, Skipped: 0, Time elapsed: 0.263 sec - in org.opensolaris.opengrok.history.CVSHistoryParserTest
Running org.opensolaris.opengrok.history.MercurialRepositoryTest
Tests run: 7, Failures: 0, Errors: 0, Skipped: 0, Time elapsed: 5.348 sec - in org.opensolaris.opengrok.history.MercurialRepositoryTest
Running org.opensolaris.opengrok.history.FileHistoryCacheTest
Tests run: 6, Failures: 0, Errors: 0, Skipped: 0, Time elapsed: 8.575 sec - in org.opensolaris.opengrok.history.FileHistoryCacheTest
Running org.opensolaris.opengrok.history.HistoryEntryTest
Tests run: 20, Failures: 0, Errors: 0, Skipped: 0, Time elapsed: 0.243 sec - in org.opensolaris.opengrok.history.HistoryEntryTest
Running org.opensolaris.opengrok.history.GitRepositoryTest
Tests run: 12, Failures: 0, Errors: 0, Skipped: 0, Time elapsed: 1.049 sec - in org.opensolaris.opengrok.history.GitRepositoryTest
Running org.opensolaris.opengrok.history.RazorHistoryParserTest
Tests run: 2, Failures: 0, Errors: 0, Skipped: 0, Time elapsed: 0.227 sec - in org.opensolaris.opengrok.history.RazorHistoryParserTest
Running org.opensolaris.opengrok.history.GitHistoryParserTest
Tests run: 5, Failures: 0, Errors: 0, Skipped: 0, Time elapsed: 0.499 sec - in org.opensolaris.opengrok.history.GitHistoryParserTest
Running org.opensolaris.opengrok.history.PerforceRepositoryTest
Tests run: 2, Failures: 0, Errors: 0, Skipped: 0, Time elapsed: 0.189 sec - in org.opensolaris.opengrok.history.PerforceRepositoryTest
Running org.opensolaris.opengrok.history.BazaarRepositoryTest
Tests run: 3, Failures: 0, Errors: 0, Skipped: 0, Time elapsed: 0.234 sec - in org.opensolaris.opengrok.history.BazaarRepositoryTest
Running org.opensolaris.opengrok.history.BitKeeperRepositoryTest
Tests run: 6, Failures: 0, Errors: 3, Skipped: 0, Time elapsed: 1.213 sec <<< FAILURE! - in org.opensolaris.opengrok.history.BitKeeperRepositoryTest
testGetHistoryGet(org.opensolaris.opengrok.history.BitKeeperRepositoryTest)  Time elapsed: 0.142 sec  <<< ERROR!
java.lang.NullPointerException
	at org.opensolaris.opengrok.history.BitKeeperRepositoryTest.readStream(BitKeeperRepositoryTest.java:167)
	at org.opensolaris.opengrok.history.BitKeeperRepositoryTest.testGetHistoryGet(BitKeeperRepositoryTest.java:176)

testGetHistory(org.opensolaris.opengrok.history.BitKeeperRepositoryTest)  Time elapsed: 0.098 sec  <<< ERROR!
org.opensolaris.opengrok.history.HistoryException
	at org.opensolaris.opengrok.history.BitKeeperRepositoryTest.testGetHistory(BitKeeperRepositoryTest.java:129)

testAnnotation(org.opensolaris.opengrok.history.BitKeeperRepositoryTest)  Time elapsed: 0.085 sec  <<< ERROR!
java.io.IOException
	at org.opensolaris.opengrok.history.BitKeeperRepositoryTest.testAnnotation(BitKeeperRepositoryTest.java:201)


Results :

Failed tests: 
  CtagsTest.setUpClass:67 No point in running ctags tests without valid ctags
  IndexerRepoTest.setUpClass:51 No point in running indexer tests without valid ctags
  IndexerTest.setUpClass:71 No point in running indexer tests without valid ctags
  PageConfigTest.canProcessHistory:102->assertCanProcess:369 expected:<> but was:<null>
  PageConfigTest.canProcessXref:122->assertCanProcess:369 expected:<> but was:<null>
  PageConfigTest.testCheckSourceRootExistence4:327 This should throw an exception when the file is not readable
  PageConfigTest.testGetAnnotation:232
Tests in error: 
  JFlexXrefTest.bug18586:351  IO Cannot run program "ctags": error=2, No such f...
  JFlexXrefTest.testBug15890Anchor:146->bug15890Anchor:162  IO Cannot run progr...
  CAnalyzerFactoryTest.testScopeAnalyzer:117  IO Cannot run program "ctags": er...
  CxxAnalyzerFactoryTest.testScopeAnalyzer:117  IO Cannot run program "ctags": ...
  ClojureAnalyzerFactoryTest.testScopeAnalyzer:114  IO Cannot run program "ctag...
  CSharpAnalyzerFactoryTest.testScopeAnalyzer:110  IO Cannot run program "ctags...
  JavaAnalyzerFactoryTest.testScopeAnalyzer:117  IO Cannot run program "ctags":...
  PascalAnalyzerFactoryTest.testAnalyzer:114  IO Cannot run program "ctags": er...
  BitKeeperRepositoryTest.testAnnotation:201  IO
  BitKeeperRepositoryTest.testGetHistory:129  History
  BitKeeperRepositoryTest.testGetHistoryGet:176->readStream:167  NullPointer
org.opensolaris.opengrok.index.IndexDatabaseTest.org.opensolaris.opengrok.index.IndexDatabaseTest
  Run 1: IndexDatabaseTest.setUpClass:54 No ctags available
  Run 2: IndexDatabaseTest.tearDownClass:72 NullPointer


Tests run: 447, Failures: 7, Errors: 12, Skipped: 0

[INFO] ------------------------------------------------------------------------
[INFO] Reactor Summary:
[INFO] 
[INFO] OpenGrok ........................................... SUCCESS [  0.005 s]
[INFO] Java RCS ........................................... SUCCESS [  2.095 s]
[INFO] OpenGrok Indexer ................................... FAILURE [02:37 min]
[INFO] OpenGrok Sample Plugins ............................ SKIPPED
[INFO] OpenGrok Web ....................................... SKIPPED
[INFO] ------------------------------------------------------------------------
[INFO] BUILD FAILURE
[INFO] ------------------------------------------------------------------------
[INFO] Total time: 02:39 min
[INFO] Finished at: 2017-04-07T21:43:07+02:00
[INFO] Final Memory: 25M/579M
[INFO] ------------------------------------------------------------------------
[ERROR] Failed to execute goal org.apache.maven.plugins:maven-surefire-plugin:2.19.1:test (default-test) on project opengrok-indexer: There are test failures.
[ERROR] 
[ERROR] Please refer to /root/workspace/OpenGrok/OpenGrok/219716179/opengrok-indexer/target/surefire-reports for the individual test results.
[ERROR] -> [Help 1]
[ERROR] 
[ERROR] To see the full stack trace of the errors, re-run Maven with the -e switch.
[ERROR] Re-run Maven using the -X switch to enable full debug logging.
[ERROR] 
[ERROR] For more information about the errors and possible solutions, please read the following articles:
[ERROR] [Help 1] http://cwiki.apache.org/confluence/display/MAVEN/MojoFailureException
[ERROR] 
[ERROR] After correcting the problems, you can resume the build with the command
[ERROR]   mvn <goals> -rf :opengrok-indexer
