[INFO] Scanning for projects...
[INFO]                                                                         
[INFO] ------------------------------------------------------------------------
[INFO] Building Stevia QA Framework - Core 0.9.11-SNAPSHOT
[INFO] ------------------------------------------------------------------------
[INFO] 
[INFO] --- maven-enforcer-plugin:1.0:enforce (enforce-maven) @ stevia-core ---
[INFO] Skipping Rule Enforcement.
[INFO] 
[INFO] --- license-maven-plugin:1.6:update-file-header (license headers) @ stevia-core ---
[INFO] adding extra resolver file:/root/workspace/persado/stevia/211809122//src/license
[INFO] Will search files to update from root /root/workspace/persado/stevia/211809122/src/main/java
[INFO] Will search files to update from root /root/workspace/persado/stevia/211809122/src/test/java
[INFO] Scan 43 files header done in 186.85ms.
[INFO] All files are up-to-date.
[INFO] 
[INFO] --- license-maven-plugin:1.6:update-project-license (license headers) @ stevia-core ---
[INFO] adding extra resolver file:/root/workspace/persado/stevia/211809122//src/license
[INFO] 
[INFO] --- license-maven-plugin:1.6:add-third-party (license headers) @ stevia-core ---
[WARNING] There is 3 dependencies with no license :
[WARNING]  - commons-collections--commons-collections--3.1
[WARNING]  - oro--oro--2.0.8
[WARNING]  - sshtools--j2ssh-core--0.2.9
[INFO] Writing third-party file to /root/workspace/persado/stevia/211809122/target/generated-sources/license/THIRD-PARTY.txt
[INFO] 
[INFO] --- license-maven-plugin:1.6:download-licenses (update 3rd party licenses) @ stevia-core ---
[WARNING] POM for dependency aopalliance:aopalliance has an invalid license URL: null
[WARNING] No license information available for: commons-collections:commons-collections
[WARNING] POM for dependency commons-lang:commons-lang has an invalid license URL: /LICENSE.txt
[WARNING] POM for dependency org.assertj:assertj-core has an invalid license URL: LICENSE.txt
[WARNING] POM for dependency org.yaml:snakeyaml has an invalid license URL: LICENSE.txt
[WARNING] No license information available for: oro:oro
[WARNING] No license information available for: sshtools:j2ssh-core
[INFO] 
[INFO] --- maven-resources-plugin:2.6:resources (default-resources) @ stevia-core ---
[INFO] Using 'UTF-8' encoding to copy filtered resources.
[INFO] Copying 1 resource
[INFO] Copying 2 resources
[INFO] 
[INFO] --- maven-compiler-plugin:2.5.1:compile (default-compile) @ stevia-core ---
[INFO] Nothing to compile - all classes are up to date
[INFO] 
[INFO] --- maven-resources-plugin:2.6:testResources (default-testResources) @ stevia-core ---
[INFO] Using 'UTF-8' encoding to copy filtered resources.
[INFO] Copying 3 resources
[INFO] 
[INFO] --- maven-compiler-plugin:2.5.1:testCompile (default-testCompile) @ stevia-core ---
[INFO] Nothing to compile - all classes are up to date
[INFO] 
[INFO] --- maven-surefire-plugin:2.14:test (default-test) @ stevia-core ---
[INFO] Surefire report directory: /root/workspace/persado/stevia/211809122/target/surefire-reports
[INFO] Downloading: https://repo.maven.apache.org/maven2/org/apache/maven/surefire/surefire-testng/2.14/surefire-testng-2.14.pom
[INFO] Downloaded: https://repo.maven.apache.org/maven2/org/apache/maven/surefire/surefire-testng/2.14/surefire-testng-2.14.pom (4 KB at 11.0 KB/sec)
[INFO] Downloading: https://repo.maven.apache.org/maven2/org/apache/maven/surefire/surefire-providers/2.14/surefire-providers-2.14.pom
[INFO] Downloaded: https://repo.maven.apache.org/maven2/org/apache/maven/surefire/surefire-providers/2.14/surefire-providers-2.14.pom (3 KB at 122.3 KB/sec)
[INFO] Downloading: https://repo.maven.apache.org/maven2/org/apache/maven/maven-artifact/2.0/maven-artifact-2.0.pom
[INFO] Downloaded: https://repo.maven.apache.org/maven2/org/apache/maven/maven-artifact/2.0/maven-artifact-2.0.pom (723 B at 39.2 KB/sec)
[INFO] Downloading: https://repo.maven.apache.org/maven2/org/apache/maven/maven/2.0/maven-2.0.pom
[INFO] Downloaded: https://repo.maven.apache.org/maven2/org/apache/maven/maven/2.0/maven-2.0.pom (9 KB at 356.8 KB/sec)
[INFO] Downloading: https://repo.maven.apache.org/maven2/org/apache/maven/surefire/common-java5/2.14/common-java5-2.14.pom
[INFO] Downloaded: https://repo.maven.apache.org/maven2/org/apache/maven/surefire/common-java5/2.14/common-java5-2.14.pom (2 KB at 80.2 KB/sec)
[INFO] Downloading: https://repo.maven.apache.org/maven2/org/testng/testng/5.7/testng-5.7.pom
[INFO] Downloaded: https://repo.maven.apache.org/maven2/org/testng/testng/5.7/testng-5.7.pom (12 KB at 557.7 KB/sec)
[INFO] Downloading: https://repo.maven.apache.org/maven2/org/apache/maven/surefire/surefire-testng/2.14/surefire-testng-2.14.jar
[INFO] Downloading: https://repo.maven.apache.org/maven2/org/apache/maven/surefire/common-java5/2.14/common-java5-2.14.jar
[INFO] Downloading: https://repo.maven.apache.org/maven2/org/apache/maven/maven-artifact/2.0/maven-artifact-2.0.jar
[INFO] Downloading: https://repo.maven.apache.org/maven2/org/codehaus/plexus/plexus-utils/1.0.4/plexus-utils-1.0.4.jar
[INFO] Downloaded: https://repo.maven.apache.org/maven2/org/apache/maven/surefire/surefire-testng/2.14/surefire-testng-2.14.jar (33 KB at 777.5 KB/sec)
[INFO] Downloaded: https://repo.maven.apache.org/maven2/org/apache/maven/maven-artifact/2.0/maven-artifact-2.0.jar (77 KB at 1373.5 KB/sec)
[INFO] Downloaded: https://repo.maven.apache.org/maven2/org/codehaus/plexus/plexus-utils/1.0.4/plexus-utils-1.0.4.jar (160 KB at 2711.3 KB/sec)
[INFO] Downloaded: https://repo.maven.apache.org/maven2/org/apache/maven/surefire/common-java5/2.14/common-java5-2.14.jar (55 KB at 342.0 KB/sec)
[INFO] Downloading: https://repo.maven.apache.org/maven2/org/apache/maven/surefire/surefire-testng-utils/2.14/surefire-testng-utils-2.14.jar
[INFO] Downloaded: https://repo.maven.apache.org/maven2/org/apache/maven/surefire/surefire-testng-utils/2.14/surefire-testng-utils-2.14.jar (29 KB at 1318.1 KB/sec)
[INFO] Downloading: https://repo.maven.apache.org/maven2/org/apache/maven/surefire/surefire-grouper/2.14/surefire-grouper-2.14.jar
[INFO] Downloaded: https://repo.maven.apache.org/maven2/org/apache/maven/surefire/surefire-grouper/2.14/surefire-grouper-2.14.jar (37 KB at 1605.2 KB/sec)

-------------------------------------------------------
 T E S T S
-------------------------------------------------------
Running TestSuite
16/03/17 20:53:31 main         WARN  - c.p.o.q.s.s.SteviaTestBase - *************************************************************************************
16/03/17 20:53:31 main         WARN  - c.p.o.q.s.s.SteviaTestBase - *** SUITE initialisation phase START                                              ***
16/03/17 20:53:31 main         WARN  - c.p.o.q.s.s.SteviaTestBase - *************************************************************************************
16/03/17 20:53:31 main         INFO  - q.s.s.c.c.r.DriverRegistry - Registering driver webdriver with driver factory com.persado.oss.quality.stevia.selenium.core.controllers.factories.WebDriverWebControllerFactoryImpl@d41f816
16/03/17 20:53:31 main         INFO  - erWebControllerFactoryImpl - Debug enabled, using Firefox Driver
16/03/17 20:53:31 main         WARN  - c.p.o.q.s.s.l.TestListener - Screenshot is disabled or Stevia is not yet initialised!!
16/03/17 20:53:31 main         INFO  - c.p.o.q.s.s.l.TestListener - Current execution path is /root/workspace/persado/stevia/211809122/target/screenshots
16/03/17 20:53:32 main         ERROR - q.s.s.l.ConditionsListener - Preconditions execution will not proceed. 9 Configurations have failed
16/03/17 20:53:32 main         ERROR - .ControllerMaskingListener - Masking will not proceed. 9 Configurations have failed
16/03/17 20:53:32 main         ERROR - q.s.s.l.ConditionsListener - Preconditions execution will not proceed. 9 Configurations have failed
16/03/17 20:53:32 main         ERROR - q.s.s.l.ConditionsListener - Preconditions execution will not proceed. 9 Configurations have failed
16/03/17 20:53:32 main         ERROR - .ControllerMaskingListener - Masking will not proceed. 9 Configurations have failed
16/03/17 20:53:32 main         ERROR - q.s.s.l.ConditionsListener - Preconditions execution will not proceed. 9 Configurations have failed
16/03/17 20:53:32 main         ERROR - q.s.s.l.ConditionsListener - Preconditions execution will not proceed. 9 Configurations have failed
16/03/17 20:53:32 main         ERROR - .ControllerMaskingListener - Masking will not proceed. 9 Configurations have failed
16/03/17 20:53:32 main         ERROR - q.s.s.l.ConditionsListener - Preconditions execution will not proceed. 9 Configurations have failed
16/03/17 20:53:32 main         ERROR - q.s.s.l.ConditionsListener - Preconditions execution will not proceed. 11 Configurations have failed
16/03/17 20:53:32 main         ERROR - .ControllerMaskingListener - Masking will not proceed. 11 Configurations have failed
16/03/17 20:53:32 main         ERROR - q.s.s.l.ConditionsListener - Preconditions execution will not proceed. 11 Configurations have failed
16/03/17 20:53:32 main         ERROR - q.s.s.l.ConditionsListener - Preconditions execution will not proceed. 11 Configurations have failed
16/03/17 20:53:32 main         ERROR - .ControllerMaskingListener - Masking will not proceed. 11 Configurations have failed
16/03/17 20:53:32 main         ERROR - q.s.s.l.ConditionsListener - Preconditions execution will not proceed. 11 Configurations have failed
16/03/17 20:53:32 main         ERROR - q.s.s.l.ConditionsListener - Preconditions execution will not proceed. 11 Configurations have failed
16/03/17 20:53:32 main         ERROR - .ControllerMaskingListener - Masking will not proceed. 11 Configurations have failed
16/03/17 20:53:32 main         ERROR - q.s.s.l.ConditionsListener - Preconditions execution will not proceed. 11 Configurations have failed
16/03/17 20:53:32 main         ERROR - q.s.s.l.ConditionsListener - Preconditions execution will not proceed. 11 Configurations have failed
16/03/17 20:53:32 main         ERROR - .ControllerMaskingListener - Masking will not proceed. 11 Configurations have failed
16/03/17 20:53:32 main         ERROR - q.s.s.l.ConditionsListener - Preconditions execution will not proceed. 11 Configurations have failed
16/03/17 20:53:32 main         ERROR - q.s.s.l.ConditionsListener - Preconditions execution will not proceed. 11 Configurations have failed
16/03/17 20:53:32 main         ERROR - .ControllerMaskingListener - Masking will not proceed. 11 Configurations have failed
16/03/17 20:53:32 main         ERROR - q.s.s.l.ConditionsListener - Preconditions execution will not proceed. 11 Configurations have failed
16/03/17 20:53:32 main         ERROR - q.s.s.l.ConditionsListener - Preconditions execution will not proceed. 11 Configurations have failed
16/03/17 20:53:32 main         ERROR - .ControllerMaskingListener - Masking will not proceed. 11 Configurations have failed
16/03/17 20:53:32 Stevia - Inactive INFO  - .p.o.q.s.s.c.SteviaContext - Context closed, controller shutdown
16/03/17 20:53:32 Stevia - Inactive ERROR - q.s.s.l.ConditionsListener - Preconditions execution will not proceed. 11 Configurations have failed
Tests run: 16, Failures: 1, Errors: 0, Skipped: 15, Time elapsed: 2.009 sec <<< FAILURE!
configureSuiteSettings(com.persado.oss.quality.stevia.tests.TestGoogleSearch)  Time elapsed: 1.413 sec  <<< FAILURE!
java.lang.IllegalStateException: The path to the driver executable must be set by the webdriver.gecko.driver system property; for more information, see https://github.com/mozilla/geckodriver. The latest version can be downloaded from https://github.com/mozilla/geckodriver/releases
	at com.google.common.base.Preconditions.checkState(Preconditions.java:738)
	at org.openqa.selenium.remote.service.DriverService.findExecutable(DriverService.java:111)
	at org.openqa.selenium.firefox.GeckoDriverService.access$100(GeckoDriverService.java:38)
	at org.openqa.selenium.firefox.GeckoDriverService$Builder.findDefaultExecutable(GeckoDriverService.java:112)
	at org.openqa.selenium.remote.service.DriverService$Builder.build(DriverService.java:302)
	at org.openqa.selenium.firefox.FirefoxDriver.toExecutor(FirefoxDriver.java:233)
	at org.openqa.selenium.firefox.FirefoxDriver.<init>(FirefoxDriver.java:125)
	at org.openqa.selenium.firefox.FirefoxDriver.<init>(FirefoxDriver.java:121)
	at com.persado.oss.quality.stevia.selenium.core.controllers.factories.WebDriverWebControllerFactoryImpl.initialize(WebDriverWebControllerFactoryImpl.java:74)
	at com.persado.oss.quality.stevia.selenium.core.controllers.SteviaWebControllerFactory.getWebController(SteviaWebControllerFactory.java:69)
	at com.persado.oss.quality.stevia.spring.SteviaTestBase.initializeStevia(SteviaTestBase.java:301)
	at com.persado.oss.quality.stevia.spring.SteviaTestBase.configureSuiteSettings(SteviaTestBase.java:134)
	at sun.reflect.NativeMethodAccessorImpl.invoke0(Native Method)
	at sun.reflect.NativeMethodAccessorImpl.invoke(NativeMethodAccessorImpl.java:62)
	at sun.reflect.DelegatingMethodAccessorImpl.invoke(DelegatingMethodAccessorImpl.java:43)
	at java.lang.reflect.Method.invoke(Method.java:498)
	at org.testng.internal.MethodInvocationHelper.invokeMethod(MethodInvocationHelper.java:80)
	at org.testng.internal.Invoker.invokeConfigurationMethod(Invoker.java:551)
	at org.testng.internal.Invoker.invokeConfigurations(Invoker.java:213)
	at org.testng.internal.Invoker.invokeConfigurations(Invoker.java:138)
	at org.testng.SuiteRunner.privateRun(SuiteRunner.java:277)
	at org.testng.SuiteRunner.run(SuiteRunner.java:240)
	at org.testng.SuiteRunnerWorker.runSuite(SuiteRunnerWorker.java:53)
	at org.testng.SuiteRunnerWorker.run(SuiteRunnerWorker.java:87)
	at org.testng.TestNG.runSuitesSequentially(TestNG.java:1170)
	at org.testng.TestNG.runSuitesLocally(TestNG.java:1095)
	at org.testng.TestNG.run(TestNG.java:1007)
	at org.apache.maven.surefire.testng.TestNGExecutor.run(TestNGExecutor.java:178)
	at org.apache.maven.surefire.testng.TestNGXmlTestSuite.execute(TestNGXmlTestSuite.java:92)
	at org.apache.maven.surefire.testng.TestNGProvider.invoke(TestNGProvider.java:96)
	at sun.reflect.NativeMethodAccessorImpl.invoke0(Native Method)
	at sun.reflect.NativeMethodAccessorImpl.invoke(NativeMethodAccessorImpl.java:62)
	at sun.reflect.DelegatingMethodAccessorImpl.invoke(DelegatingMethodAccessorImpl.java:43)
	at java.lang.reflect.Method.invoke(Method.java:498)
	at org.apache.maven.surefire.util.ReflectionUtils.invokeMethodWithArray2(ReflectionUtils.java:208)
	at org.apache.maven.surefire.booter.ProviderFactory$ProviderProxy.invoke(ProviderFactory.java:158)
	at org.apache.maven.surefire.booter.ProviderFactory.invokeProvider(ProviderFactory.java:86)
	at org.apache.maven.surefire.booter.ForkedBooter.runSuitesInProcess(ForkedBooter.java:153)
	at org.apache.maven.surefire.booter.ForkedBooter.main(ForkedBooter.java:95)


Results :

Failed tests: 
  TestGoogleSearch>SteviaTestBase.configureSuiteSettings:134->SteviaTestBase.initializeStevia:301 » IllegalState

Tests run: 16, Failures: 1, Errors: 0, Skipped: 15

[INFO] ------------------------------------------------------------------------
[INFO] BUILD FAILURE
[INFO] ------------------------------------------------------------------------
[INFO] Total time: 6.595 s
[INFO] Finished at: 2017-03-16T20:53:32+01:00
[INFO] Final Memory: 41M/542M
[INFO] ------------------------------------------------------------------------
[ERROR] Failed to execute goal org.apache.maven.plugins:maven-surefire-plugin:2.14:test (default-test) on project stevia-core: There are test failures.
[ERROR] 
[ERROR] Please refer to /root/workspace/persado/stevia/211809122/target/surefire-reports for the individual test results.
[ERROR] -> [Help 1]
[ERROR] 
[ERROR] To see the full stack trace of the errors, re-run Maven with the -e switch.
[ERROR] Re-run Maven using the -X switch to enable full debug logging.
[ERROR] 
[ERROR] For more information about the errors and possible solutions, please read the following articles:
[ERROR] [Help 1] http://cwiki.apache.org/confluence/display/MAVEN/MojoFailureException
