[INFO] Scanning for projects...
[WARNING] 
[WARNING] Some problems were encountered while building the effective model for com.github.jnr:jnr-posix:jar:3.0.40-SNAPSHOT
[WARNING] 'build.plugins.plugin.version' for org.apache.maven.plugins:maven-compiler-plugin is missing. @ line 100, column 15
[WARNING] 'build.plugins.plugin.version' for org.apache.maven.plugins:maven-javadoc-plugin is missing. @ line 152, column 15
[WARNING] 
[WARNING] It is highly recommended to fix these problems because they threaten the stability of your build.
[WARNING] 
[WARNING] For this reason, future Maven versions might no longer support building such malformed projects.
[WARNING] 
[INFO]                                                                         
[INFO] ------------------------------------------------------------------------
[INFO] Building jnr-posix 3.0.40-SNAPSHOT
[INFO] ------------------------------------------------------------------------
[INFO] 
[INFO] --- maven-enforcer-plugin:1.0:enforce (enforce-maven) @ jnr-posix ---
[INFO] Skipping Rule Enforcement.
[INFO] 
[INFO] --- maven-resources-plugin:2.6:resources (default-resources) @ jnr-posix ---
[INFO] Using 'UTF-8' encoding to copy filtered resources.
[INFO] skip non existing resourceDirectory /root/workspace/jnr/jnr-posix/230859189/src/main/resources
[INFO] 
[INFO] --- maven-compiler-plugin:3.1:compile (default-compile) @ jnr-posix ---
[INFO] Nothing to compile - all classes are up to date
[INFO] 
[INFO] --- maven-bundle-plugin:2.3.7:manifest (bundle-manifest) @ jnr-posix ---
[INFO] 
[INFO] --- maven-resources-plugin:2.6:testResources (default-testResources) @ jnr-posix ---
[INFO] Using 'UTF-8' encoding to copy filtered resources.
[INFO] skip non existing resourceDirectory /root/workspace/jnr/jnr-posix/230859189/src/test/resources
[INFO] 
[INFO] --- maven-compiler-plugin:3.1:testCompile (default-testCompile) @ jnr-posix ---
[INFO] Nothing to compile - all classes are up to date
[INFO] 
[INFO] --- maven-surefire-plugin:2.18.1:test (default-test) @ jnr-posix ---
[INFO] Surefire report directory: /root/workspace/jnr/jnr-posix/230859189/target/surefire-reports
[INFO] Downloading: https://repo.maven.apache.org/maven2/org/apache/maven/surefire/surefire-junit4/2.18.1/surefire-junit4-2.18.1.pom
[INFO] Downloaded: https://repo.maven.apache.org/maven2/org/apache/maven/surefire/surefire-junit4/2.18.1/surefire-junit4-2.18.1.pom (3 KB at 3.2 KB/sec)
[INFO] Downloading: https://repo.maven.apache.org/maven2/org/apache/maven/surefire/surefire-providers/2.18.1/surefire-providers-2.18.1.pom
[INFO] Downloaded: https://repo.maven.apache.org/maven2/org/apache/maven/surefire/surefire-providers/2.18.1/surefire-providers-2.18.1.pom (3 KB at 69.0 KB/sec)
[INFO] Downloading: https://repo.maven.apache.org/maven2/org/apache/maven/surefire/surefire-junit4/2.18.1/surefire-junit4-2.18.1.jar
[INFO] Downloaded: https://repo.maven.apache.org/maven2/org/apache/maven/surefire/surefire-junit4/2.18.1/surefire-junit4-2.18.1.jar (67 KB at 1037.4 KB/sec)

-------------------------------------------------------
 T E S T S
-------------------------------------------------------
OpenJDK 64-Bit Server VM warning: ignoring option MaxPermSize=256m; support was removed in 8.0
OpenJDK 64-Bit Server VM warning: ignoring option MaxPermSize=256m; support was removed in 8.0
Running jnr.posix.JavaPOSIXTest
Running jnr.posix.DTableSizeTest
Tests run: 5, Failures: 0, Errors: 0, Skipped: 0, Time elapsed: 0.729 sec - in jnr.posix.JavaPOSIXTest
OpenJDK 64-Bit Server VM warning: ignoring option MaxPermSize=256m; support was removed in 8.0
Running jnr.posix.HANDLETest
Tests run: 4, Failures: 0, Errors: 0, Skipped: 0, Time elapsed: 0.289 sec - in jnr.posix.HANDLETest
OpenJDK 64-Bit Server VM warning: ignoring option MaxPermSize=256m; support was removed in 8.0
Tests run: 1, Failures: 0, Errors: 0, Skipped: 0, Time elapsed: 2.478 sec - in jnr.posix.DTableSizeTest
Running jnr.posix.IOTest
OpenJDK 64-Bit Server VM warning: ignoring option MaxPermSize=256m; support was removed in 8.0
Running jnr.posix.util.PlatformTest
Tests run: 2, Failures: 0, Errors: 0, Skipped: 0, Time elapsed: 0.039 sec - in jnr.posix.util.PlatformTest
Tests run: 5, Failures: 0, Errors: 0, Skipped: 0, Time elapsed: 1.009 sec - in jnr.posix.IOTest
OpenJDK 64-Bit Server VM warning: ignoring option MaxPermSize=256m; support was removed in 8.0
OpenJDK 64-Bit Server VM warning: ignoring option MaxPermSize=256m; support was removed in 8.0
Running jnr.posix.util.DefaultPOSIXHandlerTest
Running jnr.posix.FileTest
Tests run: 1, Failures: 0, Errors: 0, Skipped: 0, Time elapsed: 1.659 sec - in jnr.posix.util.DefaultPOSIXHandlerTest
OpenJDK 64-Bit Server VM warning: ignoring option MaxPermSize=256m; support was removed in 8.0
Running jnr.posix.SpawnTest
Tests run: 4, Failures: 0, Errors: 0, Skipped: 0, Time elapsed: 1.611 sec - in jnr.posix.SpawnTest
OpenJDK 64-Bit Server VM warning: ignoring option MaxPermSize=256m; support was removed in 8.0
Running jnr.posix.NlLanginfoTest
Tests run: 1, Failures: 0, Errors: 0, Skipped: 0, Time elapsed: 0.697 sec - in jnr.posix.NlLanginfoTest
OpenJDK 64-Bit Server VM warning: ignoring option MaxPermSize=256m; support was removed in 8.0
Running jnr.posix.CryptTest
Tests run: 1, Failures: 0, Errors: 0, Skipped: 0, Time elapsed: 0.415 sec - in jnr.posix.CryptTest
OpenJDK 64-Bit Server VM warning: ignoring option MaxPermSize=256m; support was removed in 8.0
Tests run: 29, Failures: 1, Errors: 0, Skipped: 0, Time elapsed: 5.76 sec <<< FAILURE! - in jnr.posix.FileTest
accessTest(jnr.posix.FileTest)  Time elapsed: 0.006 sec  <<< FAILURE!
java.lang.AssertionError: access:  expected:<-1> but was:<0>
	at org.junit.Assert.fail(Assert.java:88)
	at org.junit.Assert.failNotEquals(Assert.java:743)
	at org.junit.Assert.assertEquals(Assert.java:118)
	at org.junit.Assert.assertEquals(Assert.java:555)
	at jnr.posix.FileTest.accessTest(FileTest.java:469)

Running jnr.posix.JavaFileStatTest
Tests run: 1, Failures: 0, Errors: 0, Skipped: 0, Time elapsed: 0.007 sec - in jnr.posix.JavaFileStatTest
OpenJDK 64-Bit Server VM warning: ignoring option MaxPermSize=256m; support was removed in 8.0
OpenJDK 64-Bit Server VM warning: ignoring option MaxPermSize=256m; support was removed in 8.0
Running jnr.posix.ProcessTest
Running jnr.posix.SignalTest
Tests run: 8, Failures: 3, Errors: 0, Skipped: 0, Time elapsed: 0.692 sec <<< FAILURE! - in jnr.posix.ProcessTest
testGetRLimitPreallocatedRlimit(jnr.posix.ProcessTest)  Time elapsed: 0.626 sec  <<< FAILURE!
java.lang.AssertionError: Bad soft limit for number of processes
	at org.junit.Assert.fail(Assert.java:88)
	at org.junit.Assert.assertTrue(Assert.java:41)
	at jnr.posix.ProcessTest.testGetRLimitPreallocatedRlimit(ProcessTest.java:66)

testGetRLimitPointer(jnr.posix.ProcessTest)  Time elapsed: 0.032 sec  <<< FAILURE!
java.lang.AssertionError: Bad soft limit for number of processes
	at org.junit.Assert.fail(Assert.java:88)
	at org.junit.Assert.assertTrue(Assert.java:41)
	at jnr.posix.ProcessTest.testGetRLimitPointer(ProcessTest.java:83)

testGetRLimit(jnr.posix.ProcessTest)  Time elapsed: 0 sec  <<< FAILURE!
java.lang.AssertionError: Bad soft limit for number of processes
	at org.junit.Assert.fail(Assert.java:88)
	at org.junit.Assert.assertTrue(Assert.java:41)
	at jnr.posix.ProcessTest.testGetRLimit(ProcessTest.java:49)

Tests run: 2, Failures: 1, Errors: 0, Skipped: 0, Time elapsed: 0.718 sec <<< FAILURE! - in jnr.posix.SignalTest
testJavaSignal(jnr.posix.SignalTest)  Time elapsed: 0.206 sec  <<< FAILURE!
java.lang.AssertionError: null
	at org.junit.Assert.fail(Assert.java:86)
	at org.junit.Assert.assertTrue(Assert.java:41)
	at org.junit.Assert.assertTrue(Assert.java:52)
	at jnr.posix.SignalTest.testJavaSignal(SignalTest.java:65)

OpenJDK 64-Bit Server VM warning: ignoring option MaxPermSize=256m; support was removed in 8.0
Running jnr.posix.LinuxPOSIXTest
OpenJDK 64-Bit Server VM warning: ignoring option MaxPermSize=256m; support was removed in 8.0
Running jnr.posix.PasswdTest
Tests run: 1, Failures: 0, Errors: 0, Skipped: 0, Time elapsed: 0.593 sec - in jnr.posix.LinuxPOSIXTest
Tests run: 2, Failures: 0, Errors: 0, Skipped: 0, Time elapsed: 0.482 sec - in jnr.posix.PasswdTest
OpenJDK 64-Bit Server VM warning: ignoring option MaxPermSize=256m; support was removed in 8.0
OpenJDK 64-Bit Server VM warning: ignoring option MaxPermSize=256m; support was removed in 8.0
Running jnr.posix.GroupTest
Running jnr.posix.FileStatTest
Tests run: 7, Failures: 0, Errors: 0, Skipped: 0, Time elapsed: 0.585 sec - in jnr.posix.FileStatTest
OpenJDK 64-Bit Server VM warning: ignoring option MaxPermSize=256m; support was removed in 8.0
Tests run: 4, Failures: 0, Errors: 0, Skipped: 0, Time elapsed: 1.23 sec - in jnr.posix.GroupTest
Running jnr.posix.IDTest
OpenJDK 64-Bit Server VM warning: ignoring option MaxPermSize=256m; support was removed in 8.0
Running jnr.posix.EnvTest
Tests run: 2, Failures: 0, Errors: 0, Skipped: 0, Time elapsed: 0.602 sec - in jnr.posix.IDTest
Tests run: 6, Failures: 0, Errors: 0, Skipped: 0, Time elapsed: 0.506 sec - in jnr.posix.EnvTest
OpenJDK 64-Bit Server VM warning: ignoring option MaxPermSize=256m; support was removed in 8.0
Running jnr.posix.POSIXFactoryTest
Tests run: 2, Failures: 0, Errors: 0, Skipped: 0, Time elapsed: 0.37 sec - in jnr.posix.POSIXFactoryTest

Results :

Failed tests: 
  FileTest.accessTest:469 access:  expected:<-1> but was:<0>
  ProcessTest.testGetRLimit:49 Bad soft limit for number of processes
  ProcessTest.testGetRLimitPointer:83 Bad soft limit for number of processes
  ProcessTest.testGetRLimitPreallocatedRlimit:66 Bad soft limit for number of processes
  SignalTest.testJavaSignal:65 null

Tests run: 88, Failures: 5, Errors: 0, Skipped: 0

[INFO] ------------------------------------------------------------------------
[INFO] BUILD FAILURE
[INFO] ------------------------------------------------------------------------
[INFO] Total time: 23.493 s
[INFO] Finished at: 2017-05-11T11:41:48+02:00
[INFO] Final Memory: 19M/312M
[INFO] ------------------------------------------------------------------------
[ERROR] Failed to execute goal org.apache.maven.plugins:maven-surefire-plugin:2.18.1:test (default-test) on project jnr-posix: There are test failures.
[ERROR] 
[ERROR] Please refer to /root/workspace/jnr/jnr-posix/230859189/target/surefire-reports for the individual test results.
[ERROR] -> [Help 1]
[ERROR] 
[ERROR] To see the full stack trace of the errors, re-run Maven with the -e switch.
[ERROR] Re-run Maven using the -X switch to enable full debug logging.
[ERROR] 
[ERROR] For more information about the errors and possible solutions, please read the following articles:
[ERROR] [Help 1] http://cwiki.apache.org/confluence/display/MAVEN/MojoFailureException
